{
  "variantId": "gpt-5-6-sol-ultra-afterlight-dispatch-2026-07-10",
  "gameNumber": 7,
  "gameSlug": "afterlight-dispatch",
  "gameTitle": "Afterlight Dispatch",
  "status": "canonical-playable",
  "createdDate": "2026-07-10",
  "modelName": "GPT-5.6 sol ultra",
  "agentName": "Codex",
  "humanCodeEdits": false,
  "implementationPath": "../../",
  "metadataPath": "variant.json",
  "notes": "Canonical first playable implementation for Observation 007 / Game 007. A deterministic six-transmission radio narrative with a pure engine shared by the browser and the committed Node verifier. The playable source lives at the game root. The model label is maintainer-declared for this project entry.",
  "comparisonRole": "baseline",
  "runRecords": [
    "../../runs/2026-07-10-gpt-5-6-sol-ultra-afterlight-dispatch-initial.json"
  ]
}
