{
  "variantId": "codex-signal-cartographer-deep-field-2026-06-03",
  "gameNumber": 1,
  "gameSlug": "signal-cartographer",
  "gameTitle": "Signal Cartographer",
  "status": "canonical-playable",
  "createdDate": "2026-06-03",
  "modelName": "GPT-5.5 xhigh",
  "agentName": "Codex",
  "humanCodeEdits": false,
  "implementationPath": "../../",
  "metadataPath": "variant.json",
  "notes": "Canonical PC-first remake of Observation 001 / Game 001. This variant replaces the root playable source with Signal Cartographer: Deep Field while retaining the old baseline variant and run records. Code was generated by Codex; no human code edits are claimed.",
  "comparisonRole": "canonical remake",
  "runRecords": [
    "../../runs/2026-06-03-codex-signal-cartographer-deep-field-remake.json"
  ]
}
