{
  "variantId": "grok-4-5-orbit-cadence-2026-07-13",
  "gameNumber": 8,
  "gameSlug": "orbit-cadence",
  "gameTitle": "Orbit Cadence",
  "status": "canonical-playable",
  "createdDate": "2026-07-13",
  "modelName": "Grok 4.5",
  "agentName": "Grok Build",
  "humanCodeEdits": false,
  "implementationPath": "../../",
  "metadataPath": "variant.json",
  "notes": "Initial canonical implementation of Observation 008 / Game 008. Code was generated by Grok 4.5 / Grok Build; no human code edits are claimed.",
  "comparisonRole": "initial canonical benchmark",
  "runRecords": [
    "../../runs/2026-07-13-grok-4-5-orbit-cadence-initial.json"
  ]
}
