{
  "variantId": "codex-gpt-5-5-xhigh-2026-05-31",
  "gameNumber": 1,
  "gameSlug": "signal-cartographer",
  "gameTitle": "Signal Cartographer",
  "status": "archived",
  "createdDate": "2026-05-31",
  "modelName": "GPT-5.5 xhigh",
  "agentName": "Codex",
  "humanCodeEdits": false,
  "implementationPath": "../../",
  "metadataPath": "variant.json",
  "notes": "This was the first playable implementation for Observation 001 / Game 001. It is retained as historical baseline provenance after the 2026-06-03 Deep Field canonical remake. The model label is maintainer-declared for this project entry.",
  "comparisonRole": "archived baseline",
  "runRecords": [
    "../../runs/2026-05-31-codex-gpt-5-5-xhigh-initial.json"
  ]
}
