{
  "variantId": "codex-neon-pulse-courier-2026-06-03",
  "gameNumber": 3,
  "gameSlug": "neon-pulse-courier",
  "gameTitle": "Neon Pulse Courier",
  "status": "canonical-playable",
  "createdDate": "2026-06-03",
  "modelName": "GPT-5 (Codex session)",
  "agentName": "Codex",
  "humanCodeEdits": false,
  "implementationPath": "../../",
  "metadataPath": "variant.json",
  "notes": "Initial canonical implementation of Observation 003 / Game 003. Code was generated by Codex; no human code edits are claimed.",
  "comparisonRole": "initial canonical benchmark",
  "runRecords": [
    "../../runs/2026-06-03-codex-neon-pulse-courier-initial.json"
  ]
}
